<?xml version="1.0" encoding="UTF-8"?>
<!ELEMENT bib ( (book | article | phd_theses)+)>
<!ELEMENT book ( author, title, year, (address)?, publisher )> 
<!ELEMENT article ( author, title, year, volume, page, journal) > 
<!ELEMENT phd_theses (author, title, year, university) >
<!ELEMENT page (from, to)>
<!ELEMENT author (first_name, last_name)>
<!ELEMENT first_name (#PCDATA) >
<!ELEMENT last_name (#PCDATA) >
<!ELEMENT title (#PCDATA)>
<!ELEMENT year (#PCDATA)>
<!ELEMENT address (#PCDATA)>
<!ELEMENT publisher (#PCDATA)>
<!ELEMENT from (#PCDATA)>
<!ELEMENT to (#PCDATA)>
<!ELEMENT journal (#PCDATA)>
<!ELEMENT volume (#PCDATA)>
<!ELEMENT university (#PCDATA)>